<!ELEMENT cartelera (pelicula+)>
<!ELEMENT pelicula (titulo, director, anyo)>
<!ELEMENT titulo (#PCDATA)>
<!ELEMENT director (#PCDATA)>
<!ELEMENT anyo (#PCDATA)>
<!ATTLIST pelicula plataforma CDATA #REQUIRED>
<!ATTLIST titulo idioma CDATA #REQUIRED>
